"ospfIfRxBadPacket",".iso.org.dod.internet.mgmt.mib-2.ospf.ospfTrap.ospfTraps.ospfIfRxBadPacket",".1.3.6.1.2.1.14.16.2.8",,,"","OSPF-TRAP-MIB","An ospfIfRxBadPacket trap signifies that an
OSPF packet has been received on a non-virtual
interface that cannot be parsed."
"ospfVirtIfRxBadPacket",".iso.org.dod.internet.mgmt.mib-2.ospf.ospfTrap.ospfTraps.ospfVirtIfRxBadPacket",".1.3.6.1.2.1.14.16.2.9",,,"","OSPF-TRAP-MIB","An ospfVirtIfRxBadPacket trap signifies that an OSPF
packet has been received on a virtual interface
that cannot be parsed."
"ospfTxRetransmit",".iso.org.dod.internet.mgmt.mib-2.ospf.ospfTrap.ospfTraps.ospfTxRetransmit",".1.3.6.1.2.1.14.16.2.10",,,"","OSPF-TRAP-MIB","An ospfTxRetransmit trap signifies than an
OSPF packet has been retransmitted on a
non-virtual interface.  All packets that may be
retransmitted are associated with an LSDB entry.
The LS type, LS ID, and Router ID are used to
identify the LSDB entry."
"ospfVirtIfTxRetransmit",".iso.org.dod.internet.mgmt.mib-2.ospf.ospfTrap.ospfTraps.ospfVirtIfTxRetransmit",".1.3.6.1.2.1.14.16.2.11",,,"","OSPF-TRAP-MIB","An ospfVirtIfTxRetransmit trap signifies than an
OSPF packet has been retransmitted on a virtual
interface.  All packets that may be retransmitted
are associated with an LSDB entry.  The LS
type, LS ID, and Router ID are used to identify
the LSDB entry."
"ospfOriginateLsa",".iso.org.dod.internet.mgmt.mib-2.ospf.ospfTrap.ospfTraps.ospfOriginateLsa",".1.3.6.1.2.1.14.16.2.12",,,"","OSPF-TRAP-MIB","An ospfOriginateLsa trap signifies that a new
LSA has been originated by this router.  This
trap should not be invoked for simple refreshes
of LSAs (which happens every 30 minutes), but
instead will only be invoked when an LSA is
(re)originated due to a topology change.
Additionally, this trap does not include LSAs that
are being flushed because they have reached
MaxAge."
"ospfMaxAgeLsa",".iso.org.dod.internet.mgmt.mib-2.ospf.ospfTrap.ospfTraps.ospfMaxAgeLsa",".1.3.6.1.2.1.14.16.2.13",,,"","OSPF-TRAP-MIB","An ospfMaxAgeLsa trap signifies that one of
the LSAs in the router's link state database has
aged to MaxAge."
"ospfLsdbOverflow",".iso.org.dod.internet.mgmt.mib-2.ospf.ospfTrap.ospfTraps.ospfLsdbOverflow",".1.3.6.1.2.1.14.16.2.14",,,"","OSPF-TRAP-MIB","An ospfLsdbOverflow trap signifies that the
number of LSAs in the router's link state
database has exceeded ospfExtLsdbLimit."
"ospfLsdbApproachingOverflow",".iso.org.dod.internet.mgmt.mib-2.ospf.ospfTrap.ospfTraps.ospfLsdbApproachingOverflow",".1.3.6.1.2.1.14.16.2.15",,,"","OSPF-TRAP-MIB","An ospfLsdbApproachingOverflow trap signifies
that the number of LSAs in the router's
link state database has exceeded ninety percent of
ospfExtLsdbLimit."
"ospfIfStateChange",".iso.org.dod.internet.mgmt.mib-2.ospf.ospfTrap.ospfTraps.ospfIfStateChange",".1.3.6.1.2.1.14.16.2.16",,,"","OSPF-TRAP-MIB","An ospfIfStateChange trap signifies that there
has been a change in the state of a non-virtual
OSPF interface.  This trap should be generated
when the interface state regresses (e.g., goes
from Dr to Down) or progresses to a terminal
state (i.e., Point-to-Point, DR Other, Dr, or
Backup)."
"ospfNssaTranslatorStatusChange",".iso.org.dod.internet.mgmt.mib-2.ospf.ospfTrap.ospfTraps.ospfNssaTranslatorStatusChange",".1.3.6.1.2.1.14.16.2.17",,,"","OSPF-TRAP-MIB","An ospfNssaTranslatorStatusChange trap indicates that
there has been a change in the router's ability to
translate OSPF type-7 LSAs into OSPF type-5 LSAs.
This trap should be generated when the translator
status transitions from or to any defined status on
a per-area basis."
"ospfRestartStatusChange",".iso.org.dod.internet.mgmt.mib-2.ospf.ospfTrap.ospfTraps.ospfRestartStatusChange",".1.3.6.1.2.1.14.16.2.18",,,"","OSPF-TRAP-MIB","An ospfRestartStatusChange trap signifies that
there has been a change in the graceful restart
state for the router.  This trap should be
generated when the router restart status
changes."
"ospfNbrRestartHelperStatusChange",".iso.org.dod.internet.mgmt.mib-2.ospf.ospfTrap.ospfTraps.ospfNbrRestartHelperStatusChange",".1.3.6.1.2.1.14.16.2.19",,,"","OSPF-TRAP-MIB","An ospfNbrRestartHelperStatusChange trap signifies that
there has been a change in the graceful restart
helper state for the neighbor.  This trap should be
generated when the neighbor restart helper status
transitions for a neighbor."
"ospfVirtNbrRestartHelperStatusChange",".iso.org.dod.internet.mgmt.mib-2.ospf.ospfTrap.ospfTraps.ospfVirtNbrRestartHelperStatusChange",".1.3.6.1.2.1.14.16.2.20",,,"","OSPF-TRAP-MIB","An ospfVirtNbrRestartHelperStatusChange trap signifies
that there has been a change in the graceful restart
helper state for the virtual neighbor.  This trap should
be generated when the virtual neighbor restart helper
status transitions for a virtual neighbor."
"coldStart",".iso.org.dod.internet.snmpV2.snmpModules.snmpMIB.snmpMIBObjects.snmpTraps.coldStart",".1.3.6.1.6.3.1.1.5.1",,,"","SNMPv2-MIB","A coldStart trap signifies that the SNMP entity,
supporting a notification originator application, is
reinitializing itself and that its configuration may
have been altered."
"warmStart",".iso.org.dod.internet.snmpV2.snmpModules.snmpMIB.snmpMIBObjects.snmpTraps.warmStart",".1.3.6.1.6.3.1.1.5.2",,,"","SNMPv2-MIB","A warmStart trap signifies that the SNMP entity,
supporting a notification originator application,
is reinitializing itself such that its configuration
is unaltered."
"authenticationFailure",".iso.org.dod.internet.snmpV2.snmpModules.snmpMIB.snmpMIBObjects.snmpTraps.authenticationFailure",".1.3.6.1.6.3.1.1.5.5",,,"","SNMPv2-MIB","An authenticationFailure trap signifies that the SNMP
entity has received a protocol message that is not
properly authenticated.  While all implementations
of SNMP entities MAY be capable of generating this
trap, the snmpEnableAuthenTraps object indicates
whether this trap will be generated."
"linkDown",".iso.org.dod.internet.snmpV2.snmpModules.snmpMIB.snmpMIBObjects.snmpTraps.linkDown",".1.3.6.1.6.3.1.1.5.3",,,"","IF-MIB","A linkDown trap signifies that the SNMP entity, acting in
an agent role, has detected that the ifOperStatus object for
one of its communication links is about to enter the down
state from some other state (but not from the notPresent
state).  This other state is indicated by the included value
of ifOperStatus."
"linkUp",".iso.org.dod.internet.snmpV2.snmpModules.snmpMIB.snmpMIBObjects.snmpTraps.linkUp",".1.3.6.1.6.3.1.1.5.4",,,"","IF-MIB","A linkUp trap signifies that the SNMP entity, acting in an
agent role, has detected that the ifOperStatus object for
one of its communication links left the down state and
transitioned into some other state (but not into the
notPresent state).  This other state is indicated by the
included value of ifOperStatus."
